{
  "id": "src-c4af34a500ab",
  "source_id": "openhands-docs",
  "cluster_id": "agent-harnesses-and-devtools",
  "title": "Automated Code Review - OpenHands Docs",
  "url": "https://docs.openhands.dev/openhands/usage/use-cases/code-review",
  "canonical_url": "https://docs.openhands.dev/openhands/usage/use-cases/code-review",
  "published_at": null,
  "fetched_at": "2026-07-01T05:11:49.766259+00:00",
  "author": null,
  "source_type": "docs",
  "trust_tier": "primary",
  "summary": "Set up automated PR reviews using OpenHands and the Software Agent SDK",
  "raw_content_path": null,
  "dedupe_key": "4e493511e360",
  "status": "new",
  "errors": []
}
