{
  "id": "src-5b9ed65cb972",
  "source_id": "openai-blog",
  "cluster_id": "frontier-ai-platforms",
  "title": "OpenAI raises $122 billion to accelerate the next phase of AI | OpenAI",
  "url": "https://openai.com/index/accelerating-the-next-phase-ai/",
  "canonical_url": "https://openai.com/index/accelerating-the-next-phase-ai/",
  "published_at": null,
  "fetched_at": "2026-07-01T05:18:19.246457+00:00",
  "author": null,
  "source_type": "blog",
  "trust_tier": "primary",
  "summary": "OpenAI raises $122 billion in new funding to expand frontier AI globally, invest in next-generation compute, and meet growing demand for ChatGPT, Codex, and enterprise AI.",
  "raw_content_path": null,
  "dedupe_key": "baca61f09ad0",
  "status": "new",
  "errors": []
}
