{
  "id": "src-0a7ea7563d50",
  "source_id": "openai-blog",
  "cluster_id": "frontier-ai-platforms",
  "title": "OpenAI launches the OpenAI Deployment Company to help businesses ...",
  "url": "https://openai.com/index/openai-launches-the-deployment-company/",
  "canonical_url": "https://openai.com/index/openai-launches-the-deployment-company/",
  "published_at": null,
  "fetched_at": "2026-07-01T05:18:19.246481+00:00",
  "author": null,
  "source_type": "blog",
  "trust_tier": "primary",
  "summary": "OpenAI launches DeployCo, a new enterprise deployment company built to help organizations bring frontier AI into production and turn it into measurable business impact.",
  "raw_content_path": null,
  "dedupe_key": "751a892e2ef7",
  "status": "new",
  "errors": []
}
