{
  "id": "src-ab2427916a80",
  "source_id": "openai-blog",
  "cluster_id": "frontier-ai-platforms",
  "title": "The next phase of enterprise AI | OpenAI",
  "url": "https://openai.com/index/next-phase-of-enterprise-ai/",
  "canonical_url": "https://openai.com/index/next-phase-of-enterprise-ai/",
  "published_at": null,
  "fetched_at": "2026-07-01T05:18:19.246438+00:00",
  "author": null,
  "source_type": "blog",
  "trust_tier": "primary",
  "summary": "OpenAI outlines the next phase of enterprise AI, as adoption accelerates across industries with Frontier, ChatGPT Enterprise, Codex, and company-wide AI agents.",
  "raw_content_path": null,
  "dedupe_key": "ab0853832854",
  "status": "new",
  "errors": []
}
