{
  "id": "src-da73692313ab",
  "source_id": "microsoft-ai-blog",
  "cluster_id": "frontier-ai-platforms",
  "title": "AI alone won't change your business. The system running it will.",
  "url": "https://blogs.microsoft.com/blog/2026/06/02/ai-alone-wont-change-your-business-the-system-running-it-will/",
  "canonical_url": "https://blogs.microsoft.com/blog/2026/06/02/ai-alone-wont-change-your-business-the-system-running-it-will/",
  "published_at": null,
  "fetched_at": "2026-07-01T05:11:44.876647+00:00",
  "author": null,
  "source_type": "blog",
  "trust_tier": "primary",
  "summary": "Become an AI-first enterprise with Microsoft’s agent platform.",
  "raw_content_path": null,
  "dedupe_key": "f4124bbb866e",
  "status": "new",
  "errors": []
}
