{
  "id": "src-39a989d445c3",
  "source_id": "microsoft-ai-blog",
  "cluster_id": "frontier-ai-platforms",
  "title": "Microsoft Build 2025: The age of AI agents and building the open ...",
  "url": "https://blogs.microsoft.com/blog/2025/05/19/microsoft-build-2025-the-age-of-ai-agents-and-building-the-open-agentic-web/",
  "canonical_url": "https://blogs.microsoft.com/blog/2025/05/19/microsoft-build-2025-the-age-of-ai-agents-and-building-the-open-agentic-web/",
  "published_at": null,
  "fetched_at": "2026-07-01T05:11:44.876640+00:00",
  "author": null,
  "source_type": "blog",
  "trust_tier": "primary",
  "summary": "TL;DR? Hear the news as an AI-generated audio overview made using Microsoft 365 Copilot. You can read the transcript here. We’ve entered the era of AI agents. Thanks to groundbreaking advancements in reasoning and memory, AI models are now more capable and efficient, and we’re seeing how ...",
  "raw_content_path": null,
  "dedupe_key": "0901ae077be0",
  "status": "new",
  "errors": []
}
