{
  "id": "src-9f3aeac87b48",
  "source_id": "google-deepmind-blog",
  "cluster_id": "frontier-ai-platforms",
  "title": "Science Needs AI Data Stocktakes: A Proof-of-Concept for Fusion ...",
  "url": "https://deepmind.google/public-policy/science-needs-ai-data-stocktakes/",
  "canonical_url": "https://deepmind.google/public-policy/science-needs-ai-data-stocktakes/",
  "published_at": null,
  "fetched_at": "2026-07-01T05:11:42.312716+00:00",
  "author": null,
  "source_type": "blog",
  "trust_tier": "primary",
  "summary": "Can AI accelerate fusion energy? This essay explores the data challenges facing fusion research and proposes \"AI data stocktakes\" to unlock scientific breakthroughs.",
  "raw_content_path": null,
  "dedupe_key": "6e1d29527039",
  "status": "new",
  "errors": []
}
