{
  "id": "src-e8a15f52c815",
  "source_id": "microsoft-ai-blog",
  "cluster_id": "frontier-ai-platforms",
  "title": "How Microsoft’s customers and partners accelerated AI ...",
  "url": "https://blogs.microsoft.com/blog/2025/07/28/how-microsofts-customers-and-partners-accelerated-ai-transformation-in-fy25-to-innovate-with-purpose-and-shape-their-future-success/",
  "canonical_url": "https://blogs.microsoft.com/blog/2025/07/28/how-microsofts-customers-and-partners-accelerated-ai-transformation-in-fy25-to-innovate-with-purpose-and-shape-their-future-success/",
  "published_at": null,
  "fetched_at": "2026-07-01T05:18:26.227056+00:00",
  "author": null,
  "source_type": "blog",
  "trust_tier": "primary",
  "summary": "Over the past fiscal year, our customers and partners have driven pragmatic outcomes by implementing AI-first strategies across their organizations. With AI Transformation as their framework, we helped them enrich employee experiences, reinvent customer engagement, reshape business processes ...",
  "raw_content_path": null,
  "dedupe_key": "558ac781b355",
  "status": "new",
  "errors": []
}
