{
  "id": "src-36b6ef7bb9a4",
  "source_id": "anthropic-news",
  "cluster_id": "frontier-ai-platforms",
  "title": "Donating the Model Context Protocol and establishing the Agentic ...",
  "url": "https://www.anthropic.com/news/donating-the-model-context-protocol-and-establishing-of-the-agentic-ai-foundation",
  "canonical_url": "https://www.anthropic.com/news/donating-the-model-context-protocol-and-establishing-of-the-agentic-ai-foundation",
  "published_at": null,
  "fetched_at": "2026-07-01T05:18:22.371820+00:00",
  "author": null,
  "source_type": "blog",
  "trust_tier": "primary",
  "summary": "Anthropic is an AI safety and research company that's working to build reliable, interpretable, and steerable AI systems.",
  "raw_content_path": null,
  "dedupe_key": "f8e84c3236af",
  "status": "new",
  "errors": []
}
