{
  "id": "src-199882dbf26e",
  "source_id": "microsoft-ai-blog",
  "cluster_id": "frontier-ai-platforms",
  "title": "Ignite 2024: Why nearly 70% of the Fortune 500 now use Microsoft ...",
  "url": "https://blogs.microsoft.com/blog/2024/11/19/ignite-2024-why-nearly-70-of-the-fortune-500-now-use-microsoft-365-copilot/",
  "canonical_url": "https://blogs.microsoft.com/blog/2024/11/19/ignite-2024-why-nearly-70-of-the-fortune-500-now-use-microsoft-365-copilot/",
  "published_at": null,
  "fetched_at": "2026-07-01T05:18:26.227029+00:00",
  "author": null,
  "source_type": "blog",
  "trust_tier": "primary",
  "summary": "Two things can be true at the same time. In the case of AI, it is absolutely true that the industry is moving incredibly fast and evolving quickly. It’s also true that hundreds of thousands of customers are using Microsoft AI technology today and, by making early bets on the platform, are ...",
  "raw_content_path": null,
  "dedupe_key": "6c04f5e58383",
  "status": "new",
  "errors": []
}
