{
  "id": "src-5af899e8b82e",
  "source_id": "google-deepmind-blog",
  "cluster_id": "frontier-ai-platforms",
  "title": "Models — Google DeepMind",
  "url": "https://deepmind.google/models/",
  "canonical_url": "https://deepmind.google/models/",
  "published_at": null,
  "fetched_at": "2026-07-01T05:18:24.171420+00:00",
  "author": null,
  "source_type": "blog",
  "trust_tier": "primary",
  "summary": "Explore our next generation AI systems including Gemini, Nano Banana, Veo and Lyria.",
  "raw_content_path": null,
  "dedupe_key": "7bddb731cc13",
  "status": "new",
  "errors": []
}
