{
  "id": "src-349336a4588f",
  "source_id": "microsoft-ai-blog",
  "cluster_id": "frontier-ai-platforms",
  "title": "Introducing the First Frontier Suite built on Intelligence + Trust ...",
  "url": "https://blogs.microsoft.com/blog/2026/03/09/introducing-the-first-frontier-suite-built-on-intelligence-trust/",
  "canonical_url": "https://blogs.microsoft.com/blog/2026/03/09/introducing-the-first-frontier-suite-built-on-intelligence-trust/",
  "published_at": null,
  "fetched_at": "2026-07-01T05:18:26.226991+00:00",
  "author": null,
  "source_type": "blog",
  "trust_tier": "primary",
  "summary": "Today Microsoft is announcing: Wave 3 of Microsoft 365 Copilot Expanded model diversity with Claude and next-gen OpenAI models available today General availability of Agent 365 on May 1 for $15 per user General availability of the new Microsoft 365 E7: The Frontier Suite on May 1 for $99 per ...",
  "raw_content_path": null,
  "dedupe_key": "aea7537532ce",
  "status": "new",
  "errors": []
}
