{
  "id": "src-eac7ef32e4a2",
  "source_id": "interconnects",
  "cluster_id": "operator-signals",
  "title": "Interconnects signal for Operator signals",
  "url": "https://www.interconnects.ai/",
  "canonical_url": "https://www.interconnects.ai/",
  "published_at": "2026-07-01T00:00:00+00:00",
  "fetched_at": "2026-07-01T05:17:50.927640+00:00",
  "author": null,
  "source_type": "newsletter",
  "trust_tier": "secondary",
  "summary": "Offline seed item from Interconnects for evaluating founder workflows, enterprise operating model, AI implementation patterns. Use live mode to replace this with current source content.",
  "raw_content_path": null,
  "dedupe_key": "f0558d3b08d8",
  "status": "new",
  "errors": []
}
