{
  "id": "src-32089927760b",
  "source_id": "google-deepmind-blog",
  "cluster_id": "frontier-ai-platforms",
  "title": "Google DeepMind Blog signal for Frontier AI platforms",
  "url": "https://deepmind.google/discover/blog/",
  "canonical_url": "https://deepmind.google/discover/blog/",
  "published_at": "2026-07-01T00:00:00+00:00",
  "fetched_at": "2026-07-01T05:17:50.921981+00:00",
  "author": null,
  "source_type": "blog",
  "trust_tier": "primary",
  "summary": "Offline seed item from Google DeepMind Blog for evaluating model releases, agent tooling, enterprise AI adoption. Use live mode to replace this with current source content.",
  "raw_content_path": null,
  "dedupe_key": "d451b6823288",
  "status": "new",
  "errors": []
}
